smartctl 7.2 2020-12-30 r5155 [x86_64-linux-5.14.0-362.13.1.el9_3.x86_64] (local build)
Copyright (C) 2002-20, Bruce Allen, Christian Franke, www.smartmontools.org

=== START OF INFORMATION SECTION ===
Model Family:     Intel S4510/S4610/S4500/S4600 Series SSDs
Device Model:     INTEL SSDSC2KB019TZ
Serial Number:    PHYI244501V01P9DGN
LU WWN Device Id: 5 5cd2e4 1561cbb02
Firmware Version: 7CV10111
User Capacity:    1,920,383,410,176 bytes [1.92 TB]
Sector Sizes:     512 bytes logical, 4096 bytes physical
Rotation Rate:    Solid State Device
Form Factor:      2.5 inches
TRIM Command:     Available, deterministic, zeroed
Device is:        In smartctl database [for details use: -P show]
ATA Version is:   ACS-3 T13/2161-D revision 5
SATA Version is:  SATA 3.2, 6.0 Gb/s (current: 6.0 Gb/s)
Local Time is:    Fri Feb  2 11:44:04 2024 EST
SMART support is: Available - device has SMART capability.
SMART support is: Enabled

=== START OF READ SMART DATA SECTION ===
SMART Attributes Data Structure revision number: 1
Vendor Specific SMART Attributes with Thresholds:
ID# ATTRIBUTE_NAME          FLAGS    VALUE WORST THRESH FAIL RAW_VALUE
  5 Reallocated_Sector_Ct   -O--CK   065   065   000    -    0
  9 Power_On_Hours          -O--CK   100   100   000    -    7862
 12 Power_Cycle_Count       -O--CK   100   100   000    -    43
170 Available_Reservd_Space PO--CK   100   100   010    -    0
171 Program_Fail_Count      -O--CK   100   100   000    -    0
172 Erase_Fail_Count        -O--CK   100   100   000    -    0
174 Unsafe_Shutdown_Count   -O--CK   100   100   000    -    35
175 Power_Loss_Cap_Test     PO--CK   100   100   010    -    2290 (43 65535)
183 SATA_Downshift_Count    -O--CK   100   100   000    -    0
184 End-to-End_Error_Count  PO--CK   100   100   090    -    0
187 Uncorrectable_Error_Cnt -O--CK   100   100   000    -    0
190 Drive_Temperature       -O---K   062   054   000    -    38 (Min/Max 37/47)
192 Unsafe_Shutdown_Count   -O--CK   100   100   000    -    35
194 Temperature_Celsius     -O---K   100   100   000    -    38
197 Pending_Sector_Count    -O--C-   100   100   000    -    0
199 CRC_Error_Count         -OSRCK   100   100   000    -    0
225 Host_Writes_32MiB       -O--CK   100   100   000    -    162410
226 Workld_Media_Wear_Indic -O--CK   100   100   000    -    51
227 Workld_Host_Reads_Perc  -O--CK   100   100   000    -    95
228 Workload_Minutes        -O--CK   100   100   000    -    471159
229 Unknown_Attribute       -O--CK   100   100   000    -    0
230 Unknown_SSD_Attribute   -O--CK   100   100   000    -    0
232 Available_Reservd_Space PO--CK   100   100   010    -    0
233 Media_Wearout_Indicator -O--CK   100   100   000    -    0
234 Thermal_Throttle_Status -O--CK   100   100   000    -    0/0
235 Power_Loss_Cap_Test     PO--CK   100   100   010    -    2290 (43 65535)
241 Host_Writes_32MiB       -O--CK   100   100   000    -    162410
242 Host_Reads_32MiB        -O--CK   100   100   000    -    3273636
243 NAND_Writes_32MiB       -O--CK   100   100   000    -    425195
246 Unknown_Attribute       -O--CK   100   100   000    -    0
                            ||||||_ K auto-keep
                            |||||__ C event count
                            ||||___ R error rate
                            |||____ S speed/performance
                            ||_____ O updated online
                            |______ P prefailure warning

smartctl 7.2 2020-12-30 r5155 [x86_64-linux-5.14.0-362.13.1.el9_3.x86_64] (local build)
Copyright (C) 2002-20, Bruce Allen, Christian Franke, www.smartmontools.org

=== START OF INFORMATION SECTION ===
Model Family:     Intel S4510/S4610/S4500/S4600 Series SSDs
Device Model:     INTEL SSDSC2KB019TZ
Serial Number:    PHYI244500RW1P9DGN
LU WWN Device Id: 5 5cd2e4 1561cb20b
Firmware Version: 7CV10111
User Capacity:    1,920,383,410,176 bytes [1.92 TB]
Sector Sizes:     512 bytes logical, 4096 bytes physical
Rotation Rate:    Solid State Device
Form Factor:      2.5 inches
TRIM Command:     Available, deterministic, zeroed
Device is:        In smartctl database [for details use: -P show]
ATA Version is:   ACS-3 T13/2161-D revision 5
SATA Version is:  SATA 3.2, 6.0 Gb/s (current: 6.0 Gb/s)
Local Time is:    Fri Feb  2 11:44:04 2024 EST
SMART support is: Available - device has SMART capability.
SMART support is: Enabled

=== START OF READ SMART DATA SECTION ===
SMART Attributes Data Structure revision number: 1
Vendor Specific SMART Attributes with Thresholds:
ID# ATTRIBUTE_NAME          FLAGS    VALUE WORST THRESH FAIL RAW_VALUE
  5 Reallocated_Sector_Ct   -O--CK   066   066   000    -    0
  9 Power_On_Hours          -O--CK   100   100   000    -    7862
 12 Power_Cycle_Count       -O--CK   100   100   000    -    43
170 Available_Reservd_Space PO--CK   100   100   010    -    0
171 Program_Fail_Count      -O--CK   100   100   000    -    0
172 Erase_Fail_Count        -O--CK   100   100   000    -    0
174 Unsafe_Shutdown_Count   -O--CK   100   100   000    -    35
175 Power_Loss_Cap_Test     PO--CK   100   100   010    -    2334 (43 65535)
183 SATA_Downshift_Count    -O--CK   100   100   000    -    0
184 End-to-End_Error_Count  PO--CK   100   100   090    -    0
187 Uncorrectable_Error_Cnt -O--CK   100   100   000    -    0
190 Drive_Temperature       -O---K   061   057   000    -    39 (Min/Max 37/44)
192 Unsafe_Shutdown_Count   -O--CK   100   100   000    -    35
194 Temperature_Celsius     -O---K   100   100   000    -    39
197 Pending_Sector_Count    -O--C-   100   100   000    -    0
199 CRC_Error_Count         -OSRCK   100   100   000    -    0
225 Host_Writes_32MiB       -O--CK   100   100   000    -    129644
226 Workld_Media_Wear_Indic -O--CK   100   100   000    -    61
227 Workld_Host_Reads_Perc  -O--CK   100   100   000    -    96
228 Workload_Minutes        -O--CK   100   100   000    -    471155
229 Unknown_Attribute       -O--CK   100   100   000    -    0
230 Unknown_SSD_Attribute   -O--CK   100   100   000    -    0
232 Available_Reservd_Space PO--CK   100   100   010    -    0
233 Media_Wearout_Indicator -O--CK   100   100   000    -    0
234 Thermal_Throttle_Status -O--CK   100   100   000    -    0/0
235 Power_Loss_Cap_Test     PO--CK   100   100   010    -    2334 (43 65535)
241 Host_Writes_32MiB       -O--CK   100   100   000    -    129644
242 Host_Reads_32MiB        -O--CK   100   100   000    -    3305355
243 NAND_Writes_32MiB       -O--CK   100   100   000    -    479184
246 Unknown_Attribute       -O--CK   100   100   000    -    0
                            ||||||_ K auto-keep
                            |||||__ C event count
                            ||||___ R error rate
                            |||____ S speed/performance
                            ||_____ O updated online
                            |______ P prefailure warning

